{
  "schemaVersion": "jstack.launch.controls.v1",
  "catalogVersion": "1.0.0",
  "sourceProvenance": {
    "sourceUrl": "https://nicoburkart.notion.site/e6e88fff5ddf48a09248e2c8368445d1?v=3a293082ae3e81d0b778000c94c436d0&p=3a493082ae3e819bb4f0d4e52c1cc446&pm=s",
    "reviewedAt": "2026-07-22",
    "adaptationNotice": "JStack adapted the source checklist into applicability-aware engineering controls. Source priorities are retained as provenance, while JStack gate levels, evidence rules, safety boundaries, and conditional applicability are independent engineering judgments."
  },
  "surfaces": [
    {"id": "core", "description": "Every production software change, including services without a public browser surface."},
    {"id": "public-web", "description": "An internet-reachable website, application, API, or documentation surface."},
    {"id": "browser-ui", "description": "A user interface rendered and operated in a web browser."},
    {"id": "authenticated", "description": "A surface with login, authorization, entitlements, or paywall decisions."},
    {"id": "database", "description": "A change that stores or reads application data from a database."},
    {"id": "transactional-email", "description": "A product that sends signup, account, billing, or other transactional email."},
    {"id": "search-indexed", "description": "A public surface intended to be discovered through search engines."},
    {"id": "performance-sensitive", "description": "A user-facing surface with an explicit latency or web-performance expectation."},
    {"id": "analytics", "description": "A product that emits analytics events or product measurement data."},
    {"id": "payments", "description": "A product that initiates, receives, or reconciles monetary transactions."},
    {"id": "commercial", "description": "A product offered to customers, subscribers, or paying users."},
    {"id": "tracking", "description": "A product using cookies, recordings, advertising, or non-essential behavioral tracking."},
    {"id": "ai-paid-endpoints", "description": "An endpoint whose abuse creates meaningful AI, vendor, or compute cost."},
    {"id": "regulated-data", "description": "A product handling personal, financial, health, or otherwise regulated data."}
  ],
  "statuses": ["pass", "fail", "incomplete", "not-applicable", "waived"],
  "evidenceKinds": [
    "automated-test",
    "browser-test",
    "code-review",
    "configuration-snapshot",
    "delivery-test",
    "human-attestation",
    "legal-document",
    "manual-test",
    "monitoring-report",
    "performance-report",
    "provider-receipt",
    "security-scan"
  ],
  "controls": [
    {
      "id": "security-database-row-access",
      "sequence": 1,
      "category": "security",
      "title": "Enforce database row-level access boundaries",
      "objective": "Prove that anonymous and cross-tenant access cannot read or mutate protected database rows outside the intended policy.",
      "sourcePriority": "blocker",
      "gateLevel": "blocker",
      "applicability": {"allOf": ["database"], "anyOf": []},
      "evidenceKinds": ["automated-test", "configuration-snapshot", "security-scan"],
      "verificationMethods": ["Inspect effective database policies", "Run negative anonymous and cross-tenant access tests", "Record any privileged-service bypass boundary"],
      "maxAgeMinutes": 1440,
      "ownerRole": "security",
      "waivable": false,
      "allowNotApplicable": false,
      "safetyNotes": "A framework setting or migration file alone is not proof that the effective production policy denies unintended access."
    },
    {
      "id": "security-server-side-authz",
      "sequence": 2,
      "category": "security",
      "title": "Enforce authentication and entitlements on the server",
      "objective": "Prove that protected data and actions remain inaccessible when browser checks, routes, or client state are bypassed.",
      "sourcePriority": "blocker",
      "gateLevel": "blocker",
      "applicability": {"allOf": ["authenticated"], "anyOf": []},
      "evidenceKinds": ["automated-test", "code-review", "security-scan"],
      "verificationMethods": ["Trace authorization at the authoritative server boundary", "Run unauthenticated and wrong-role negative tests", "Verify paywall or entitlement decisions cannot be client-forged"],
      "maxAgeMinutes": 1440,
      "ownerRole": "security",
      "waivable": false,
      "allowNotApplicable": false,
      "safetyNotes": "Client-side route guards and hidden controls are usability features, not authorization evidence."
    },
    {
      "id": "security-environment-route-exposure",
      "sequence": 3,
      "category": "security",
      "title": "Verify environment and diagnostic routes expose no secrets",
      "objective": "Confirm that common environment, debug, source-map, backup, and diagnostic paths reveal no configuration or credentials.",
      "sourcePriority": "blocker",
      "gateLevel": "blocker",
      "applicability": {"allOf": ["core"], "anyOf": ["public-web", "browser-ui"]},
      "evidenceKinds": ["automated-test", "manual-test", "security-scan"],
      "verificationMethods": ["Probe common environment and backup paths", "Review production error and debug behavior", "Confirm source maps and diagnostics contain no secrets"],
      "maxAgeMinutes": 1440,
      "ownerRole": "security",
      "waivable": false,
      "allowNotApplicable": false,
      "safetyNotes": "Evidence must record status and hashes, not secret values or raw sensitive responses."
    },
    {
      "id": "security-client-secret-exposure",
      "sequence": 4,
      "category": "security",
      "title": "Keep privileged secrets out of client-delivered assets",
      "objective": "Prove that browser bundles, source maps, static assets, logs, and public configuration contain no privileged credential.",
      "sourcePriority": "blocker",
      "gateLevel": "blocker",
      "applicability": {"allOf": ["browser-ui"], "anyOf": []},
      "evidenceKinds": ["automated-test", "code-review", "security-scan"],
      "verificationMethods": ["Scan built client artifacts", "Trace privileged configuration to server-only boundaries", "Verify exposed credentials are rotated rather than merely removed"],
      "maxAgeMinutes": 1440,
      "ownerRole": "security",
      "waivable": false,
      "allowNotApplicable": false,
      "safetyNotes": "Public client identifiers may be acceptable only when their privilege model is documented and server-side controls remain authoritative."
    },
    {
      "id": "security-https-enforcement",
      "sequence": 5,
      "category": "security",
      "title": "Enforce HTTPS and validate the deployed certificate",
      "objective": "Verify secure transport, redirect behavior, certificate validity, and the absence of mixed active content on the intended public origin.",
      "sourcePriority": "first-week",
      "gateLevel": "required",
      "applicability": {"allOf": ["public-web"], "anyOf": []},
      "evidenceKinds": ["automated-test", "configuration-snapshot", "provider-receipt"],
      "verificationMethods": ["Validate certificate chain and hostname", "Verify HTTP redirects safely to HTTPS", "Check browser-visible mixed-content failures"],
      "maxAgeMinutes": 1440,
      "ownerRole": "devops",
      "waivable": true,
      "allowNotApplicable": false,
      "safetyNotes": "Do not weaken certificate verification in order to make a launch check pass."
    },
    {
      "id": "security-expensive-endpoint-rate-limits",
      "sequence": 6,
      "category": "security",
      "title": "Rate-limit endpoints that create material cost or abuse risk",
      "objective": "Prove that expensive AI, vendor, compute, or mutation endpoints have identity-aware limits and bounded failure behavior.",
      "sourcePriority": "first-week",
      "gateLevel": "required",
      "applicability": {"allOf": ["ai-paid-endpoints"], "anyOf": []},
      "evidenceKinds": ["automated-test", "configuration-snapshot", "monitoring-report"],
      "verificationMethods": ["Exercise burst and sustained-rate limits", "Verify limits cannot be bypassed by trivial identity changes", "Confirm rejection paths do not invoke the costly dependency"],
      "maxAgeMinutes": 1440,
      "ownerRole": "security",
      "waivable": true,
      "allowNotApplicable": false,
      "safetyNotes": "A client-side debounce or button disable is not a server-side abuse boundary."
    },
    {
      "id": "email-domain-authentication",
      "sequence": 7,
      "category": "email",
      "title": "Configure and verify SPF, DKIM, and DMARC",
      "objective": "Confirm that the deployed sending domain has aligned authentication records and an intentional DMARC policy.",
      "sourcePriority": "blocker",
      "gateLevel": "blocker",
      "applicability": {"allOf": ["transactional-email"], "anyOf": []},
      "evidenceKinds": ["configuration-snapshot", "delivery-test", "provider-receipt"],
      "verificationMethods": ["Inspect live DNS records", "Verify message authentication headers", "Confirm alignment between visible From and authenticated domains"],
      "maxAgeMinutes": 1440,
      "ownerRole": "devops",
      "waivable": false,
      "allowNotApplicable": false,
      "safetyNotes": "Record results without storing mailbox credentials, provider keys, or full message bodies."
    },
    {
      "id": "email-transactional-delivery",
      "sequence": 8,
      "category": "email",
      "title": "Exercise every launch-critical transactional email",
      "objective": "Verify that required account and commercial email paths are triggered, delivered, rendered, linked, and recoverable.",
      "sourcePriority": "blocker",
      "gateLevel": "blocker",
      "applicability": {"allOf": ["transactional-email"], "anyOf": []},
      "evidenceKinds": ["automated-test", "delivery-test", "manual-test"],